{
  "video_desktop": {
    "id": 0,
    "url": "https://thepetstudio.local/wp-content/uploads/pet-studio/media/video/pet_studio_backround_v01.mp4"
  },
  "video_mobile": {
    "id": 0,
    "url": "https://thepetstudio.local/wp-content/uploads/pet-studio/media/video/pet_studio_backround_v01.mp4"
  },
  "headline": "Expert Dog Grooming",
  "headline_accent": "& Professional Dog Grooming Training",
  "supporting_copy": "For over 26 years, The Pet Studio has helped dogs look and feel their best while inspiring the next generation of professional dog groomers. Whether you're looking for exceptional grooming or a rewarding new career, you'll find experience, compassion and expertise at the heart of everything we do.",
  "headline_words": [
    {
      "word": "Compassionate.",
      "subtitle": "Dogs always come first."
    },
    {
      "word": "Experienced.",
      "subtitle": "Over 26 years of trusted care."
    },
    {
      "word": "Inspiring.",
      "subtitle": "Helping future groomers build rewarding careers."
    }
  ],
  "hours_title": "Opening Hours",
  "hours_text": "Monday - Friday\n9 am - 4 pm",
  "cta_text": "Book Grooming",
  "cta_link": {
    "url": "https://pawsuite.co.uk/training-enquiry/the-pet-studio-grooming-ltd",
    "is_external": true,
    "nofollow": false
  },
  "cta2_text": "Explore Training",
  "cta2_link": {
    "url": "/grooming-academy/",
    "is_external": false,
    "nofollow": false
  },
  "show_signature": true,
  "signature_image": {
    "id": 0,
    "url": "https://thepetstudio.local/wp-content/uploads/pet-studio/media/logos/Liza_signature_pink_v06.svg"
  },
  "signature_rotation": -18
}
